{
  "$schema": "https://json-schema.org/draft/2020-12/schema",
  "type": "object",
  "additionalProperties": false,
  "required": ["name", "version", "description", "author", "skills", "interface"],
  "properties": {
    "name": {"const": "design-dna"},
    "version": {"type": "string", "pattern": "^(0|[1-9][0-9]*)\\.(0|[1-9][0-9]*)\\.(0|[1-9][0-9]*)(?:-(?:(?:0|[1-9][0-9]*)|(?:[0-9]*[A-Za-z-][0-9A-Za-z-]*))(?:\\.(?:(?:0|[1-9][0-9]*)|(?:[0-9]*[A-Za-z-][0-9A-Za-z-]*)))*)?(?:\\+[0-9A-Za-z-]+(?:\\.[0-9A-Za-z-]+)*)?$"},
    "description": {"type": "string", "minLength": 10, "maxLength": 200},
    "author": {
      "type": "object", "additionalProperties": false, "required": ["name"],
      "properties": {"name": {"type": "string", "minLength": 1}}
    },
    "license": {"const": "Proprietary"},
    "keywords": {
      "type": "array",
      "minItems": 3,
      "maxItems": 16,
      "uniqueItems": true,
      "items": {
        "type": "string",
        "minLength": 2,
        "maxLength": 40,
        "pattern": "^[a-z0-9]+(?:-[a-z0-9]+)*$"
      }
    },
    "skills": {"const": "./skills/"},
    "interface": {
      "type": "object",
      "required": ["displayName", "shortDescription", "longDescription", "developerName", "category", "capabilities", "defaultPrompt"],
      "properties": {
        "displayName": {"type": "string", "minLength": 1, "maxLength": 64},
        "shortDescription": {"type": "string", "minLength": 25, "maxLength": 64},
        "longDescription": {"type": "string", "minLength": 25, "maxLength": 300},
        "developerName": {"type": "string", "minLength": 1},
        "category": {"type": "string", "minLength": 1},
        "capabilities": {"type": "array", "minItems": 1, "uniqueItems": true, "items": {"type": "string"}},
        "defaultPrompt": {"type": "array", "minItems": 1, "maxItems": 5, "uniqueItems": true, "items": {"type": "string", "minLength": 1, "maxLength": 128}},
        "brandColor": {"type": "string", "pattern": "^#[0-9A-Fa-f]{6}$"}
      },
      "additionalProperties": false
    }
  }
}
