{
  "name": "design-dna",
  "version": "13.6.1",
  "description": "Explicit-request-only skill for specific, source-authorized website design. Use only when the human asks for Design DNA; generic website, UI, review, and audit requests do not activate it.",
  "author": {
    "name": "Motty"
  },
  "license": "Proprietary",
  "keywords": [
    "web-design",
    "frontend",
    "art-direction",
    "creative-direction",
    "route-family",
    "design-review",
    "responsive-design",
    "connected-public-experience",
    "project-contrast",
    "direction-challenge",
    "non-generic"
  ],
  "skills": "./skills/",
  "interface": {
    "displayName": "Design DNA",
    "shortDescription": "Explicit-request-only source-authorized web design.",
    "longDescription": "Explicit-request-only skill for specific, source-authorized website design. Use only when the human asks for Design DNA; generic website, UI, review, and audit requests do not activate it.",
    "developerName": "Motty",
    "category": "Productivity",
    "capabilities": [
      "Read",
      "Write"
    ],
    "defaultPrompt": [
      "Use $design-dna: all visual decisions need qualified measured references or approved project authority; never invent design."
    ],
    "brandColor": "#164E63"
  }
}
